{
  "schema_version": "1.0.0",
  "status": "ready",
  "language_updates": {
    "context_doc_path": "CONTEXT.md",
    "added": [
      {
        "term": "Pitched Standalone Video",
        "definition": "A standalone video whose pitchId is non-null."
      }
    ],
    "changed": [
      {
        "term": "Standalone Video",
        "definition": "A video with lessonId IS NULL, independent of pitch association."
      }
    ],
    "deprecated": []
  },
  "adr_candidates": [
    {
      "decision_id": "DEC-001",
      "title": "Restrict pitch deletion while videos are attached",
      "qualification": "Hard to reverse data behavior, surprising without context, and meaningful trade-off in user workflow.",
      "hard_to_reverse": true,
      "surprising_without_context": true,
      "tradeoff_consequences": true,
      "status": "queued"
    }
  ],
  "readiness_gate": {
    "core_terms_reconciled": true,
    "open_decisions": [],
    "adr_state": "queued",
    "implementation_slice_bounded": true
  },
  "issue_inputs": [
    {
      "issue_id": "ADR-ISSUE-001",
      "title": "Record pitch deletion ADR",
      "problem_statement": "Deletion behavior is non-obvious and must be documented before implementation.",
      "scope_in": [
        "Draft ADR with alternatives",
        "Link ADR in context docs"
      ],
      "scope_out": [
        "Database migration implementation"
      ],
      "acceptance_criteria": [
        "ADR committed with decision and consequences",
        "Alternatives documented"
      ],
      "dependencies": [],
      "blocked_by": [],
      "risks": [
        "Unclear deletion behavior causes production data mistakes"
      ],
      "docs_to_update": [
        "CONTEXT.md"
      ],
      "test_notes": [
        "No runtime tests required for docs-only ADR"
      ],
      "kind": "adr"
    },
    {
      "issue_id": "IMPL-ISSUE-001",
      "title": "Add pitch entity and video association",
      "problem_statement": "Need pitch packaging model and link to standalone videos.",
      "scope_in": [
        "Add pitch data model",
        "Add pitchId association on videos",
        "Manual status field support"
      ],
      "scope_out": [
        "Status automation via timestamps"
      ],
      "acceptance_criteria": [
        "Pitches can exist with zero videos",
        "Deletion restriction enforced"
      ],
      "dependencies": [
        "ADR-ISSUE-001"
      ],
      "blocked_by": [
        "ADR-ISSUE-001"
      ],
      "risks": [
        "Term mismatch if context docs are stale"
      ],
      "docs_to_update": [
        "CONTEXT.md",
        "ARCHITECTURE_REVIEW.md"
      ],
      "test_notes": [
        "Add migration and model tests",
        "Add delete restriction integration test"
      ],
      "kind": "implementation"
    }
  ],
  "architecture_followups": {
    "review_doc_path": "ARCHITECTURE_REVIEW.md",
    "cadence": "weekly",
    "items": [
      {
        "summary": "Review coupling between pitch workflows and standalone video listing",
        "owner": "platform-team",
        "due_date": "2026-06-05",
        "risk_if_delayed": "Growing coupling may slow future packaging features"
      }
    ]
  },
  "allow_deprecated_terms_for_migration": false
}
